{
  "Name": "E-co.lab Regenerative Finance Ecosystem",
  "Purpose": "The purpose of the product is to create a comprehensive regenerative finance ecosystem that transforms traditional community practices into liquid, transparent, and sustainable digital assets. The system democratizes access to sustainable agriculture through tokenized community participation, incentivizes environmental stewardship through verifiable impact tokenization, builds accessible technology that bridges traditional practices with modern financial systems, and demonstrates measurable positive impact on communities and environment. The ecosystem enables farmers to secure upfront funding through community commitment while providing community members with direct access to fresh, local produce, creates transparent tracking of environmental impact and sustainability efforts, eliminates technical barriers for non-technical users to participate in sustainable finance, and establishes quantifiable metrics for environmental and social impact.",
  "Responsibilities": [
    "It is the responsibility of the SuD to enable farmers to secure upfront funding through community commitment by implementing tokenized membership systems and automated fund collection mechanisms",
    "It is the responsibility of the SuD to provide community members with direct access to fresh, local produce through membership purchase and weekly box redemption systems",
    "It is the responsibility of the SuD to create transparent and fair distribution mechanisms for agricultural benefits through automated fund allocation and transparent reporting",
    "It is the responsibility of the SuD to establish verifiable participation rights that can be transferred or traded through ERC-1155 tokenization and marketplace functionality",
    "It is the responsibility of the SuD to create transparent tracking of environmental impact and sustainability efforts through comprehensive data collection and verification systems",
    "It is the responsibility of the SuD to enable monetization of positive environmental actions through digital assets by implementing credit tokenization and trading mechanisms",
    "It is the responsibility of the SuD to establish trustless verification of environmental claims and impact through blockchain-based verification and audit trails",
    "It is the responsibility of the SuD to facilitate trading and exchange of environmental value between stakeholders through marketplace and swap functionality",
    "It is the responsibility of the SuD to eliminate technical barriers for non-technical users to participate in sustainable finance through intuitive interfaces and social authentication",
    "It is the responsibility of the SuD to create intuitive interfaces that make complex financial instruments understandable through progressive disclosure and educational content",
    "It is the responsibility of the SuD to enable seamless integration between traditional and digital financial systems through API access and cross-chain compatibility",
    "It is the responsibility of the SuD to provide transparent and auditable records of all transactions and commitments through comprehensive event logging and blockchain verification",
    "It is the responsibility of the SuD to create quantifiable metrics for environmental and social impact through automated data collection and analytics systems",
    "It is the responsibility of the SuD to enable transparent reporting of sustainability outcomes and benefits through real-time dashboards and automated report generation",
    "It is the responsibility of the SuD to establish verifiable proof of community economic benefits through impact measurement and stakeholder communication systems",
    "It is the responsibility of the SuD to demonstrate scalability potential for broader adoption and impact through modular architecture and cross-chain deployment capabilities"
  ],
  "Exclusions": [
    "The SuD does not provide direct agricultural services or farming operations - this is handled by external farmers and agricultural partners",
    "The SuD does not manage physical produce storage or distribution logistics - this is handled by external logistics providers and farmers",
    "The SuD does not provide financial advisory services or investment advice - users make their own financial decisions",
    "The SuD does not handle regulatory compliance for individual jurisdictions - this is the responsibility of users and local authorities",
    "The SuD does not provide insurance or risk management services for agricultural operations - this is handled by external insurance providers",
    "The SuD does not manage user wallet custody or private key storage - this is handled by external wallet providers and users",
    "The SuD does not provide legal services or contract enforcement beyond smart contract execution - this is handled by external legal providers",
    "The SuD does not manage environmental certification or verification beyond blockchain-based tracking - this is handled by external certifiers and standards bodies",
    "The SuD does not provide banking services or fiat currency conversion - this is handled by external financial service providers",
    "The SuD does not manage user identity verification beyond blockchain-based authentication - this is handled by external identity providers"
  ]
}
